{
  "version": "1.0.0",
  "org": "YOUR-ORG",
  "generated_at": "2026-01-01T00:00:00Z",
  "pr_mode": false,
  "impacted_repositories": [
    "your-org/repo1",
    "your-org/repo2"
  ],
  "waves": [
    {
      "wave_id": 1,
      "repos": [
        "your-org/repo1"
      ]
    },
    {
      "wave_id": 2,
      "repos": [
        "your-org/repo2"
      ]
    }
  ]
}